Bengali,Example Sentence,Translation
অংক,এটি অংক,This is math
অঙ্ক,এটি অঙ্ক,This is math
অংশু,এটি একটি অংশু,This is a sunbeam
অক্ষ,এটি একটি অক্ষ,This is a die
অগ্নি,এটি একটি অগ্নি,This is a fire
অগ্নি,এটি একটি অগ্নি,This is a fire
আগুন,এটি একটি আগুন,This is a fire
আগুন,এটি একটি আগুন,This is a fire
অনুবাদ,এটি একটি অনুবাদ,This is a translation
অনুমতি,এটি অনুমতি,This is permission
অবতার,সে একজন অবতার,He is an avatar
অশোক,সে অশোক,He is Ashok
অস্থি,এটি একটি,This is a bone
আঁই,এ আঁই,This is me
আমি,এ আমি,This is me
আঁকা,এটি একটি আঁকা,This is a drawing
আঁঠু,এটি একটি আঁঠু,This is a knee
আঁডু,এটি একটি আঁডু,This is a knee
আকাশ,এটি একটি আকাশ,This is a sky
আছে,এটি আছে,This exists
আজি,আজি করিলাম,I did it today
আট,এটি একটি আট,This is an eight
আষ্ট,এটি একটি আষ্ট,This is an eight
আদা,এটি একটি আদা,This is a ginger
আম,এটি একটি আম,This is a mango
ইতিহাস,এটি একটি ইতিহাস,This is a history
উট,এটি একটি উট,This is a camel
উত্তর,এটি একটি উত্তর,This is an answer
উপত্যকা,এটি একটি উপত্যকা,This is a valley
উপন্যাস,এটি একটি উপন্যাস,This is a novel
ঋতু,এটি একটি ঋতু,This is a season
এক,এটি একটি এক,This is a one
এক,এটি একটি এক,This is a one
একলা,একলা করলাম,I did it alone
একলা,একলা করলাম,I did it alone
একতা,এটি একতা,This is unity
ঔষধ,এটি একটি ঔষধ,This is a medicine
কচু,এটি একটি কচু,This is a taro
কচুয়া,এটি একটি কচুয়া,This is a green
কথা,এটি একটি কথা,This is a talk
কবি,সে একজন কবি,He is a poet
কম্বল,এটি একটি কম্বল,This is a blanket
কর্ণ,এটি একটি কর্ণ,This is an ear
কান,এটি একটি কান,This is an ear
কলা,এটি একটি কলা,This is a banana
কলা,এটি একটি কলা,This is a banana
কালি,কালি করিলাম,I did it yesterday
কালি,কালি করিলাম,I did it yesterday
কহা,সে কহে,He speaks
কহা,সে কহে,He speaks
কাঁচ,এটি একটি কাঁচ,This is a glass
কাঁচ,এটি একটি কাঁচ,This is a glass
কাছ,এটি একটি কাছ,This is a vicinity
কাছ,এটি একটি কাছ,This is a vicinity
কাটা,এটি কাটে,This cuts
কাটা,এটি কাটে,This cuts
কাটা,এটি কাটে,This cuts
কাঠ,এটি কাঠ,This is wood
কাতি,মাস কাতি,The month is Kartika
কিন্তু,কিন্তু করলাম,But I did
কুঁকড়া,এটি একটি কুঁকড়া,This is a rooster
কুকুর,এটি একটি কুকুর,This is a dog
কুটুম,সে একজন কুটুম,He is a relative
কৃষ্ণ,সে কৃষ্ণ,He is Krishna
কেন্দ্ৰ,এটি একটি কেন্দ্ৰ,This is a center
কেলা,এটি একটি কেলা,This is a banana
কোটি,এটি একটি কোটি,This is a crore
কোদাল,এটি একটি কোদাল,This is a spade
কোন,কোনটা ভাল?,Which one is good?
ক্যা,ক্যা করলাম ?,Why did I do it?
ক্রিয়া,এটি একটি ক্রিয়া,This is a verb
খাট,এটি একটি খাট,This is a bed
খাদ্য,এটি একটি খাদ্য,This is a food
গম,এটি একটি গম,This is a wheat
গলা,এটি একটি গলা,This is a neck
গলা,এটি একটি গলা,This is a neck
গলা,এটি একটি গলা,This is a neck
গাঁও,এটি একটি গাঁও,This is a village
গাঁও,এটি একটি গাঁও,This is a village
গু,এটি গু,This is excrement
গুহা,এটি একটি গুহা,This is a cave
গোলন্দাজ,সে একজন গোলন্দাজ,He is a gunner
গোলন্দাজ,সে একজন গোলন্দাজ,He is a gunner
গোসাঁই,সে একজন গোসাঁই,He is a lord
গোসাঁই,সে একজন গোসাঁই,He is a lord
গোসাঁই,সে একজন গোসাঁই,He is a lord
ঘড়ি,এটি একটি ঘড়ি,This is a watch
ঘাম,এটি ঘাম,This is sweat
ঘামা,সে ঘামে,He sweats
ঘামা,সে ঘামে,He sweats
ঘোড়া,এটি একটি ঘোড়া,This is a horse
চলা,সে চলে,He walks
চাঁদ,এটি একটি চাঁদ,This is a moon
চাঁদ,এটি একটি চাঁদ,This is a moon
চাঁদ,এটি একটি চাঁদ,This is a moon
চাঁদ,এটি একটি চাঁদ,This is a moon
চান,এটি একটি চান,This is a shower
চান,এটি একটি চান,This is a shower
চান,এটি একটি চান,This is a shower
চান,এটি একটি চান,This is a shower
চাকা,এটি একটি চাকা,This is a wheel
চাকা,এটি একটি চাকা,This is a wheel
চাকা,এটি একটি চাকা,This is a wheel
চাকা,এটি একটি চাকা,This is a wheel
চাকা,এটি একটি চাকা,This is a wheel
চিন্তা,এটি একটি চিন্তা,This is a thought
চৈত,মাস চৈত,The month is Chaitra
ছবি,এটি একটি ছয়,This is a picture
ছয়,এটি একটি ছয়,This is a six
ছাগলী,এটি একটি ছাগলী,This is a goat
জন্তু,এটি একটি জন্তু,This is an animal
জল,এটি জল,This is water
জানা,সে জানে,He knows
জানা,সে জানে,He knows
জেঠ,মাস জেঠ,The month is Jyaistha
জ্ঞান,এটি জ্ঞান,This is knowledge
ঝিঙা,এটি একটি টাং,This is a ridge gourd
টাং,এটি একটি টাং,This is a foot
টাং,এটি একটি টাং,This is a foot
টাং,এটি একটি টাং,This is a foot
টাকা,এটি টেহা ,This is money
টাকা,এটি টেহা ,This is money
টাকা,এটি টেহা ,This is money
টেহা,এটি টেহা ,This is money
টেহা,এটি টেহা ,This is money
টেহা,এটি টেহা ,This is money
ঠেং,এটি একটি ঠেং,This is a leg
ঠেং,এটি একটি ঠেং,This is a leg
ঠেং,এটি একটি ঠেং,This is a leg
ডাঁশ,এটি একটি ডাঁশ,This is a gnat
ডাঙর,এটি ডাঙর,This is big
ডাঙর,এটি ডাঙর,This is big
ডাঙর,এটি ডাঙর,This is big
ডিম,এটি একটি ডিম,This is an egg
ডিম,এটি একটি ডিম,This is an egg
ঢোল,এটি একটি ঢোল,This is a Dhol
তাই,তাই করলাম ,Therefore I did it
তামা,এটি তামা,This is copper
তিতা,এটি তিতা,This is bitter
তিমি,এটি একটি তিমি,This is a whale
তুমি,এ তুমি,এ তুমি
তেল,এটি তেল ,This is oil
দশ,এটি একটি দশ,This is a ten
দাঁত,এটি একটি দাঁত,This is a tooth
দাউদাউ,দাউদাউ করে আগুন জ্বলছে,The fire is burning wildly
দাড়ি,এটি একটি দাড়ি,This is a beard
দাম,এটি একটি দাম,This is a price
দিন,এটি একটি দিন,This is a day
দুঃখ,এটি দুঃখ দুঃখ,This is a sorrow
দুখ,এটি দুখ দুখ,This is a sorrow
দুই,এটি একটি দুই,This is a two
দুগ্ধ,এটি দুগ্ধ,This is milk
দুধ,এটি দুধ,This is milk
দ্বার,এটি একটি দ্বার,This is a door
দ্বীপ,এটি একটি দ্বীপ,This is a lamp
ধনিয়া,এটি ধনিয়া,This is coriander
ধন্যবাদ,এটি একটি ধন্যবাদ,This is a thanks
ধর্ম,এটি একটি ধর্ম,This is a religion
ধুমা,এটি ধুমা,This is smoke
ধোঁয়া,এটি ধোঁয়া,This is smoke
নখ,এটি একটি,This is a nail
নগর,এটি একটি,This is a city
নতুন,এটি নতুন,This is new
নদী,এটি একটি নদী,This is a river
নাই,এটি একটি নাই,This is a boat
নাও,এটি একটি নাও,This is a boat
নাম,এটি একটি নাম,This is a name
নীল,এটি নীল,This is blue
নীহারিকা,এটি একটি নীহারিকা,This is a nebula
পদ্ম,এটি একটি পদ্ম,This is a lotus
পশু,এটি একটি পশু,This is an animal
পাঁচ,এটি একটি পাঁচ,This is a five
পাখ,এটি একটি পাখ,This is a wing
পাখা,এটি একটি পাখা,This is a wing
পাখি,এটি একটি পাখি,This is a bird
পাণ,এটি একটি পাণ,This is a betel leaf
পাতা,এটি একটি পাতা,This is a leaf
পানি,এটি পানি,This is water
পানীয়,এটি পানীয়,This is drinkable
পায়স,এটি পায়স,This is kheer
পিতা,সে একজন পিতা,He is a father
পিন্ধা,সে পিন্ধে,He wears
পিন্ধা,সে পিন্ধে,He wears
পুত,সে একজন পুত,He is a son
পুরুষ,সে একজন পুরুষ,He is a man
পুষ্প,এটি একটি পুষ্প,This is a flower
পুস্তক,এটি একটি পুস্তক,This is a book
পেঁচা,এটি একটি পেঁচা,This is an owl
পো,সে একজন পো,He is a son
পোলা,সে একজন পোলা,He is a boy 
পোলা,সে একজন পোলা,He is a boy 
পোলা,সে একজন পোলা,He is a boy 
পোষ,মাস পোষ,The month is Pausha
প্রাচীন,এটি প্রাচীন,This is old
ফণী,এটি একটি ফণী,This is a snake
ফল,এটি একটি ফল,This is a fruit
ফুল,এটি একটি ফুল,This is a flower
বঙ্গ,এটি বঙ্গ,This is Bengal
বাংলা,এটি বাংলা,This is Bengali
বাঙালি,সে একজন বাঙালি,He is a Bengali
বাঙ্গালী,সে একজন বাঙ্গালী,He is a Bengali
বস্তু,এটি একটি বস্তু,This is an object
বহুত,এটি বহুত,This is a lot
বা,এটি বা ওটি,This or that
বাঁশ,এটি বাঁশ,This is bamboo
বাউল,সে একজন বাউল,He is a Baul
বাউল,সে একজন বাউল,He is a Baul
বাঘ,এটি একটি বাঘ,This is a tiger
ব্যাঘ্র,এটি একটি ব্যাঘ্র,This is a tiger
বাজ,এটি বাজ,This is thunder
বাজ,এটি বাজ,This is thunder
বাট,এটি একটি বাট,This is a path
বান,এটি একটি বান,This is a flood
বায়ু,এটি একটি বায়ু,This is a wind
বাল,সে একজন বাল,This is a boy
বিছা,এটি একটি বিছা,This is a scorpion
বিছা,এটি একটি বিছা,This is a scorpion
বিজ্ঞান,এটি বিজ্ঞান,This is science
বিলাই,এটি একটি বিলাই,This is a cat
বিলাই,এটি একটি বিলাই,This is a cat
বিষ,এটি একটি বিষ,This is a poison
বিষ,এটি একটি বিষ,This is a poison
বুদ্ধি,এটি বুদ্ধি,This is intelligence
বুধবার,দিন বুধবার,The day is Wednesday
বেঁকা,এটি বেঁকা,This is bent
বেল,এটি একটি বেল,This is a bael
বোন,এটি একটি বেল,This is a bael
বোন,এটি একটি বেল,This is a bael
ব্যবহার,এটি একটি ব্যবহার,This is a behavior
ব্যাকরণ,এটি ব্যাকরণ,This is grammar
ভইষ,এটি একটি ভইষ,This is a buffalo
মহিষ,এটি একটি মহিষ,This is a buffalo
ভয়,এটি ভয়,This is fear
ভাই,সে একজন ভাই,He is a brother
ভাজা,এটি ভাজা,This is fried
ভাজা,এটি ভাজা,This is fried
ভাত,এটি ভাত,This is rice
ভাত,এটি ভাত,This is rice
ভারত,এটি ভারত,This is India
ভাল,এটি ভাল,This is good
ভালুক,এটি একটি ভালুক,This is a bear
ভাষা,এটি একটি ভাষা,This is a language
মই,এটি একটি মই,This is a ladder
মকাই,এটি মকাই,This is maize
মাহই,এটি মকাই,This is maize
মঙ্গলবার,দিন মঙ্গলবার,The day is Tuesday
ময়ূর,এটি একটি ময়ূর,This is a peacock
ময়ূর,এটি একটি ময়ূর,This is a peacock
মাংস,এটি মাংস,This is meat
মাংস,এটি মাংস,This is meat
মাক্‌খি,এটি একটি মাক্‌খি,This is a fly
মাছ,এটি একটি মাছ,This is a fish
মাঝ,এটি মাঝ,This is the middle
মাত,এটি একটি মাত,This is a speech
মাতা,সে একজন মাতা,She is a mother
মিছা,এটি একটি মিছা,This is a lie
মিঠা,এটি মিঠা,This is sweet
মিডা,এটি মিডা,This is sweet
মিষ্টি,এটি মিষ্টি,This is sweet
মু,এটি একটি মু,This is a face
মুখ,এটি একটি মুখ,This is a face
মুঠা,এটি একটি মুঠা,This is a fist
মুঠা,এটি একটি মুঠা,This is a fist
মুঠা,এটি একটি মুঠা,This is a fist
মুঠি,এটি একটি মুঠি,This is a fist
মুঠি,এটি একটি মুঠি,This is a fist
মুঠি,এটি একটি মুঠি,This is a fist
মুঠো,এটি একটি মুঠো,This is a fist
মুঠো,এটি একটি মুঠো,This is a fist
মুঠো,এটি একটি মুঠো,This is a fist
মূত্র,এটি মূত্র,This is urine
মূল,এটি মূল,This is the root
মৃত্যু,এটি একটি মৃত্যু,This is a death
মেঘ,এটি একটি মেঘ,This is a cloud
মেয়ে,সে একজন মেয়ে,She is a girl
মৈ,এটি একটি মৈ,This is a ladder
যুদ্ধ,এটি একটি যুদ্ধ,This is a war
যোনি,এটি একটি যোনি,This is a vagina
রং,এটি একটি রং,This is a color
রং,এটি একটি রং,This is a color
রঙ,এটি একটি রঙ,This is a color
রঙ,এটি একটি রঙ,This is a color
রাং,এটি রাং,This is tin
রাং,এটি রাং,This is tin
রউন,এটি রউন,This is garlic
রসুন,এটি রসুন,This is garlic
রচনা,এটি একটি রচনা,This is a composition
রবিবার,দিন রবিবার,The day is Sunday
রাষ্ট্র,এটি একটি রাষ্ট্র,This is a nation
লবণ,এটি লবণ,This is salt
লাউ,এটি লাউ,This is calabash
লাউ,এটি লাউ,This is calabash
লাখ,এটি একটি লাখ,This is a lakh
লাজ,এটি লাজ,This is shame
লিপি,এটি একটি লিপি,This is a writing
শনিবার,দিন শনিবার,The day is Saturday
শব্দ,এটি একটি শব্দ,This is a word
শাওন,মাস শাওন,The month is Shraavana
শিক্ষা,এটি শিক্ষা,This is learning
শিক্ষা,এটি শিক্ষা,This is learning
শিক্ষা,এটি শিক্ষা,This is learning
শিল,এটি একটি শিল,This is a stone
শুখা,এটি শুখা,This is dry
শূন্য,এটি শূন্য,This is empty
শেখা,সে শেখে,He learns
শৈবাল,এটি শৈবাল,This is algae
শ্রী,শ্রী রাম এখানে আছেন,Mr. Ram is here
শ্রীবৃক্ষ,এটি একটি শ্রীবৃক্ষ,This is a bael fruit tree
সকল,এটি সকল,This is all
হক্কল,এটি হক্কল,This is all
হগল,এটি হগল,This is all
সন্ধ্যা,এটি একটি সন্ধ্যা,This is an evening
সাঁঝ,এটি একটি সাঁঝ,This is an evening
সময়,এটি সময়,This is time 
সমান,এটি সমান, This is the same
সমানে,সমানে করলাম,I did it ceaselessly
হমান,এটি হমান,This is the same
সর্প,এটি একটি সর্প,This is a snake
সাপ,এটি একটি সাপ,This is a snake
সহা,সে সহে,He tolerates
সাঁকো,এটি একটি সাঁকো,This is a bamboo bridge
সাঁচা,এটি সাঁচা,This is true
সাঁচা,এটি সাঁচা,This is true
সাগর,এটি একটি সাগর,This is a sea
হাওর,এটি একটি হাওর,This is a waterlogged expanse
সাত,এটি একটি সাত,This is a seven
সিংহ,এটি একটি সিংহ,This is a lion
সোমবার,দিন সোমবার,The day is Monday
স্বাধীনতা,এটি স্বাধীনতা,This is freedom
হাচা,এটি হাচা,This is true
হাট,এটি একটি হাট,This is a market
হাট,এটি একটি হাট,This is a market
হাত,এটি একটি হাত,This is a hand
হামি,এ হামি,This is me
হাল,এটি একটি হাল, This is a situation
হিংসা,এটি হিংসা,This is jealousy
হিম,এটি হিম,This is winter
হিয়া,এটি একটি হিয়া,This is a heart
হৃদয়,এটি একটি হৃদয়,This is a heart